{
  "schemaVersion": "1.1",
  "observations": [
    {
      "id": "obs-body-weight-sparse-increase",
      "type": "body_weight_trend",
      "scope": "body_weight",
      "onsetWeek": 1,
      "throughWeek": 12,
      "confidence": "low",
      "evidence": [
        {
          "metric": "bodyWeightAverageKg",
          "fromWeek": 1,
          "throughWeek": 12,
          "trend": "increasing",
          "details": "Зафиксированная недельная масса выросла с 82.0 кг на неделе 1 до 82.3 кг на неделе 12; измерения есть только на неделях 1, 5, 9 и 12."
        }
      ],
      "summary": "Редкие измерения показывают небольшое увеличение за период, но не подтверждают устойчивый тренд массы тела."
    }
  ],
  "hypotheses": [],
  "recommendations": [
    {
      "type": "collect_more_data",
      "basedOn": [
        "obs-body-weight-sparse-increase"
      ],
      "priority": "medium",
      "action": "Собирать массу тела чаще и продолжить фиксировать leg-press на последовательных неделях, чтобы оценить устойчивый тренд и сопоставимые изменения нагрузки и повторений."
    }
  ],
  "limitations": [
    {
      "type": "insufficient_history",
      "impact": "Четыре выполнения leg-press за 12 недель с большими календарными пропусками недостаточны для вывода о прогрессии, плато или снижении результата."
    },
    {
      "type": "measurement_sparsity",
      "impact": "Средняя недельная масса тела зафиксирована только на четырех неделях, поэтому небольшой рост не позволяет надежно оценить динамику."
    },
    {
      "type": "missing_recovery_data",
      "impact": "Нет данных о сне, готовности или восстановлении, поэтому их связь с результатами определить нельзя."
    },
    {
      "type": "missing_nutrition_intake_data",
      "impact": "Нет фактических данных о потреблении энергии и белка, поэтому влияние питания определить нельзя."
    },
    {
      "type": "missing_technique_data",
      "impact": "Нет данных о качестве выполнения, амплитуде движения или видеозаписях, поэтому влияние техники определить нельзя."
    }
  ]
}
