{
  "schemaVersion": "1.1",
  "observations": [
    {
      "id": "obs-barbell-squat-plateau",
      "type": "performance_plateau",
      "scope": "exercise",
      "exerciseId": "barbell-squat",
      "onsetWeek": 1,
      "throughWeek": 6,
      "confidence": "high",
      "evidence": [
        {
          "metric": "maxWeightKg",
          "fromWeek": 1,
          "throughWeek": 6,
          "trend": "stable",
          "details": "Максимальный рабочий вес приседа оставался 100 кг на каждой из шести недель."
        },
        {
          "metric": "totalReps",
          "fromWeek": 1,
          "throughWeek": 6,
          "trend": "stable",
          "details": "Суммарно выполнялось 23 повторения на каждой неделе."
        },
        {
          "metric": "workingSetCount",
          "fromWeek": 1,
          "throughWeek": 6,
          "trend": "consistent",
          "details": "На каждой неделе выполнялось по 3 рабочих подхода."
        }
      ],
      "summary": "В приседе шесть последовательных выполнений сохранялись на 100 кг, 23 повторениях и 3 рабочих подходах без улучшения результата."
    },
    {
      "id": "obs-barbell-bench-press-plateau",
      "type": "performance_plateau",
      "scope": "exercise",
      "exerciseId": "barbell-bench-press",
      "onsetWeek": 1,
      "throughWeek": 6,
      "confidence": "high",
      "evidence": [
        {
          "metric": "maxWeightKg",
          "fromWeek": 1,
          "throughWeek": 6,
          "trend": "stable",
          "details": "Максимальный рабочий вес жима лежа оставался 80 кг на каждой из шести недель."
        },
        {
          "metric": "totalReps",
          "fromWeek": 1,
          "throughWeek": 6,
          "trend": "stable",
          "details": "Суммарно выполнялось 23 повторения на каждой неделе."
        },
        {
          "metric": "workingSetCount",
          "fromWeek": 1,
          "throughWeek": 6,
          "trend": "consistent",
          "details": "На каждой неделе выполнялось по 3 рабочих подхода."
        }
      ],
      "summary": "В жиме лежа шесть последовательных выполнений сохранялись на 80 кг, 23 повторениях и 3 рабочих подходах без улучшения результата."
    },
    {
      "id": "obs-barbell-row-plateau",
      "type": "performance_plateau",
      "scope": "exercise",
      "exerciseId": "barbell-row",
      "onsetWeek": 1,
      "throughWeek": 6,
      "confidence": "high",
      "evidence": [
        {
          "metric": "maxWeightKg",
          "fromWeek": 1,
          "throughWeek": 6,
          "trend": "stable",
          "details": "Максимальный рабочий вес тяги штанги оставался 70 кг на каждой из шести недель."
        },
        {
          "metric": "totalReps",
          "fromWeek": 1,
          "throughWeek": 6,
          "trend": "stable",
          "details": "Суммарно выполнялось 23 повторения на каждой неделе."
        },
        {
          "metric": "workingSetCount",
          "fromWeek": 1,
          "throughWeek": 6,
          "trend": "consistent",
          "details": "На каждой неделе выполнялось по 3 рабочих подхода."
        }
      ],
      "summary": "В тяге штанги шесть последовательных выполнений сохранялись на 70 кг, 23 повторениях и 3 рабочих подходах без улучшения результата."
    },
    {
      "id": "obs-program-wide-plateau",
      "type": "performance_plateau",
      "scope": "program",
      "onsetWeek": 1,
      "throughWeek": 6,
      "confidence": "high",
      "evidence": [
        {
          "metric": "maxWeightKg",
          "fromWeek": 1,
          "throughWeek": 6,
          "trend": "stable",
          "details": "Максимальный рабочий вес оставался неизменным во всех шести неделях.",
          "exerciseId": "barbell-squat"
        },
        {
          "metric": "maxWeightKg",
          "fromWeek": 1,
          "throughWeek": 6,
          "trend": "stable",
          "details": "Максимальный рабочий вес оставался неизменным во всех шести неделях.",
          "exerciseId": "barbell-bench-press"
        },
        {
          "metric": "maxWeightKg",
          "fromWeek": 1,
          "throughWeek": 6,
          "trend": "stable",
          "details": "Максимальный рабочий вес оставался неизменным во всех шести неделях.",
          "exerciseId": "barbell-row"
        }
      ],
      "summary": "В приседе, жиме лежа и тяге штанги шесть последовательных выполнений сохранялись без роста веса, повторений или числа рабочих подходов."
    }
  ],
  "hypotheses": [
    {
      "id": "hyp-plateau-cause-uncertain",
      "type": "insufficient_evidence",
      "confidence": "high",
      "basedOn": [
        "obs-barbell-squat-plateau",
        "obs-barbell-bench-press-plateau",
        "obs-barbell-row-plateau",
        "obs-program-wide-plateau"
      ],
      "reasoning": "Метрики подтверждают локальное и общепрограммное плато, но не содержат данных, позволяющих определить его причину."
    }
  ],
  "recommendations": [
    {
      "type": "adjust_progression",
      "basedOn": [
        "obs-barbell-squat-plateau",
        "obs-barbell-bench-press-plateau",
        "obs-barbell-row-plateau",
        "obs-program-wide-plateau",
        "hyp-plateau-cause-uncertain"
      ],
      "priority": "high",
      "action": "Пересмотреть критерии и шаг прогрессии для трех упражнений и проверить изменение результата в следующих нескольких выполнениях; не считать восстановление, питание или технику подтвержденной причиной без новых данных."
    }
  ],
  "limitations": [
    {
      "type": "missing_recovery_data",
      "impact": "Нет данных о сне, готовности или восстановлении, поэтому нельзя оценить их вклад в плато."
    },
    {
      "type": "missing_nutrition_intake_data",
      "impact": "Нет фактических данных о потреблении энергии и белка, поэтому влияние питания не установлено."
    },
    {
      "type": "missing_technique_data",
      "impact": "Нет данных о технике, амплитуде движения или видеозаписях, поэтому технические ограничения не оценены."
    }
  ]
}
