{
  "schemaVersion": "1.1",
  "observations": [
    {
      "id": "obs-barbell-row-performance-decline",
      "type": "performance_decline",
      "scope": "exercise",
      "exerciseId": "barbell-row",
      "onsetWeek": 2,
      "throughWeek": 6,
      "confidence": "high",
      "evidence": [
        {
          "metric": "totalReps",
          "fromWeek": 2,
          "throughWeek": 6,
          "trend": "decreasing",
          "details": "Общее число повторений снизилось с 30 до 19 за пять последовательных выполнений."
        },
        {
          "metric": "maxWeightKg",
          "fromWeek": 2,
          "throughWeek": 6,
          "trend": "stable",
          "details": "Максимальный рабочий вес оставался 80 кг."
        },
        {
          "metric": "workingSetCount",
          "fromWeek": 2,
          "throughWeek": 6,
          "trend": "stable",
          "details": "Во всех выполнениях было по 3 рабочих подхода."
        },
        {
          "metric": "effort",
          "fromWeek": 2,
          "throughWeek": 6,
          "trend": "consistent",
          "details": "Первые два подхода отмечены как high, последний как maximum во всех выполнениях."
        }
      ],
      "summary": "При неизменных 80 кг, трёх подходах и сопоставимом усилии результат снизился с 30 до 19 повторений в течение недель 2-6."
    },
    {
      "id": "obs-body-weight-stable",
      "type": "body_weight_trend",
      "scope": "body_weight",
      "onsetWeek": 1,
      "throughWeek": 6,
      "confidence": "medium",
      "evidence": [
        {
          "metric": "bodyWeightAverageKg",
          "fromWeek": 1,
          "throughWeek": 6,
          "trend": "stable",
          "details": "Средняя недельная масса тела колебалась в диапазоне 82.0-82.1 кг, итоговое изменение составило 0.0 кг."
        }
      ],
      "summary": "Средняя недельная масса тела оставалась практически стабильной на уровне около 82 кг."
    }
  ],
  "hypotheses": [
    {
      "id": "hyp-barbell-row-decline-cause-uncertain",
      "type": "insufficient_evidence",
      "confidence": "high",
      "basedOn": [
        "obs-barbell-row-performance-decline"
      ],
      "reasoning": "Данные подтверждают устойчивое снижение результата, но не содержат информации о сне, восстановлении, питании, технике, боли или травме, поэтому причину установить нельзя."
    }
  ],
  "recommendations": [
    {
      "type": "modify_intensity",
      "exerciseId": "barbell-row",
      "basedOn": [
        "obs-barbell-row-performance-decline"
      ],
      "priority": "high",
      "action": "На следующих выполнениях снизить интенсивность или нагрузку до уровня, позволяющего снова выполнять целевой диапазон повторений, и отслеживать восстановление результата при тех же трёх подходах."
    },
    {
      "type": "collect_more_data",
      "basedOn": [
        "obs-barbell-row-performance-decline",
        "hyp-barbell-row-decline-cause-uncertain"
      ],
      "priority": "medium",
      "action": "Собрать данные о сне, субъективном восстановлении, питании, технике и боли, чтобы различить возможные причины снижения результата."
    }
  ],
  "limitations": [
    {
      "type": "missing_recovery_data",
      "impact": "Нельзя оценить, связано ли снижение результата с недостаточным сном, восстановлением или накопленной усталостью."
    },
    {
      "type": "missing_nutrition_intake_data",
      "impact": "Заявленная фаза maintenance не подтверждает фактическое потребление энергии и белка, поэтому влияние питания не определяется."
    },
    {
      "type": "missing_technique_data",
      "impact": "Нет данных о качестве выполнения, амплитуде движения или технике, поэтому технические изменения нельзя исключить."
    },
    {
      "type": "missing_pain_or_injury_data",
      "impact": "Нет данных о боли или травме, поэтому их влияние на снижение результата нельзя оценить."
    },
    {
      "type": "measurement_sparsity",
      "impact": "Масса тела измерялась один раз в неделю, поэтому небольшие краткосрочные изменения могут быть не отражены."
    }
  ]
}
