{
  "schemaVersion": "1.1",
  "observations": [
    {
      "id": "obs-cable-row-load-progression",
      "type": "performance_progression",
      "scope": "exercise",
      "exerciseId": "cable-row",
      "onsetWeek": 1,
      "throughWeek": 6,
      "confidence": "high",
      "evidence": [
        {
          "metric": "maxWeightKg",
          "fromWeek": 1,
          "throughWeek": 6,
          "trend": "increasing",
          "details": "Максимальный рабочий вес вырос с 50 кг в неделях 1-3 до 55 кг в неделях 4-6."
        },
        {
          "metric": "totalReps",
          "fromWeek": 4,
          "throughWeek": 6,
          "trend": "increasing",
          "details": "После повышения веса общее число повторений выросло с 24 до 26."
        },
        {
          "metric": "workingSetCount",
          "fromWeek": 1,
          "throughWeek": 6,
          "trend": "stable",
          "details": "На каждой тренировке выполнено по 3 рабочих подхода."
        },
        {
          "metric": "effort",
          "fromWeek": 1,
          "throughWeek": 6,
          "trend": "consistent",
          "details": "Во всех тренировках первые два подхода отмечены как high, третий как maximum."
        }
      ],
      "summary": "Нагрузка выросла с 50 до 55 кг на неделе 4; снижение повторений с 32 до 24 было ожидаемым reset после повышения веса, затем повторения восстановились до 26 к неделе 6."
    },
    {
      "id": "obs-body-weight-increase",
      "type": "body_weight_trend",
      "scope": "body_weight",
      "onsetWeek": 1,
      "throughWeek": 6,
      "confidence": "medium",
      "evidence": [
        {
          "metric": "bodyWeightAverageKg",
          "fromWeek": 1,
          "throughWeek": 6,
          "trend": "increasing",
          "details": "Средняя недельная масса тела выросла с 80,0 до 80,5 кг."
        }
      ],
      "summary": "Средняя недельная масса тела последовательно увеличивалась на 0,1 кг в неделю."
    },
    {
      "id": "obs-training-consistency",
      "type": "training_consistency",
      "scope": "program",
      "onsetWeek": 1,
      "throughWeek": 6,
      "confidence": "high",
      "evidence": [
        {
          "metric": "workoutCount",
          "fromWeek": 1,
          "throughWeek": 6,
          "trend": "consistent",
          "details": "Есть по одной уникальной тренировке в каждой из шести последовательных недель."
        }
      ],
      "summary": "Тренировки покрывают все шесть последовательных недель без пропусков."
    }
  ],
  "hypotheses": [],
  "recommendations": [
    {
      "type": "maintain_current_plan",
      "exerciseId": "cable-row",
      "basedOn": [
        "obs-cable-row-load-progression"
      ],
      "priority": "medium",
      "action": "Сохранить текущую нагрузку 55 кг и продолжить план двойной прогрессии, отслеживая дальнейший рост повторений в 3 рабочих подходах перед следующим повышением веса."
    }
  ],
  "limitations": [
    {
      "type": "missing_recovery_data",
      "impact": "Нет данных о сне, готовности или восстановлении, поэтому их влияние на результаты определить нельзя."
    },
    {
      "type": "missing_nutrition_intake_data",
      "impact": "Есть только заявленная фаза питания и масса тела, но нет фактических данных об энергии и белке."
    },
    {
      "type": "missing_technique_data",
      "impact": "Нет данных о технике, амплитуде движения или видеозаписи, поэтому сопоставимость выполнения не проверяется."
    },
    {
      "type": "measurement_sparsity",
      "impact": "Масса тела измерена только один раз в неделю, поэтому недельные средние отражают единичные измерения и могут быть чувствительны к краткосрочным колебаниям."
    }
  ]
}
